{
    "schemaVersion":  2,
    "applicationId":  "wecom",
    "variantId":  "default",
    "displayName":  {
                        "zh-CN":  "企业微信",
                        "en-US":  "WeCom"
                    },
    "match":  {
                  "executables":  [
                                      "WXWork.exe"
                                  ],
                  "publishers":  [

                                 ],
                  "versionRange":  null,
                  "packageFamilyNames":  [

                                         ],
                  "distribution":  null
              },
    "hotkeys":  [

                ]
}
